{
  "$schema": "../../schemas/scenario.schema.json",
  "meta": {
    "sources": [
      "src.seatofpower_authored"
    ],
    "notes": "Generated by tools/pipeline/author_xdate.py (package 12). Dates, countries and playable parties from package 03."
  },
  "id": "scenario.xdate",
  "startDate": "2027-02-01",
  "endDate": "2027-10-31",
  "countries": [
    "country.usa",
    "country.jpn",
    "country.chn",
    "country.eu",
    "country.sau",
    "country.gbr",
    "country.can",
    "country.mex"
  ],
  "scheduledEvents": [
    {
      "date": "2027-05-02",
      "eventId": "event.usa.tax_receipts_surprise"
    }
  ],
  "nameKey": "scenario.xdate.name",
  "descriptionKey": "scenario.xdate.description",
  "playableCountry": "country.usa",
  "playableParties": [
    "party.usa.democratic",
    "party.usa.republican"
  ],
  "varOverrides": {
    "econ.debt_limit_headroom@country.usa": 0,
    "econ.treasury_cash@country.usa": 555
  },
  "partyVariants": [
    {
      "party": "party.usa.democratic",
      "seatOverrides": [
        {
          "chamber": "chamber.usa.senate",
          "bloc": "pc.usa.senate_dem_progressive",
          "seats": 15
        },
        {
          "chamber": "chamber.usa.senate",
          "bloc": "pc.usa.senate_dem_mainstream",
          "seats": 36
        },
        {
          "chamber": "chamber.usa.senate",
          "bloc": "pc.usa.senate_rep_mainstream",
          "seats": 40
        },
        {
          "chamber": "chamber.usa.senate",
          "bloc": "pc.usa.senate_rep_hardline",
          "seats": 9
        }
      ]
    },
    {
      "party": "party.usa.republican",
      "seatOverrides": [
        {
          "chamber": "chamber.usa.house",
          "bloc": "pc.usa.house_dem_progressive",
          "seats": 97
        },
        {
          "chamber": "chamber.usa.house",
          "bloc": "pc.usa.house_dem_mainstream",
          "seats": 88
        },
        {
          "chamber": "chamber.usa.house",
          "bloc": "pc.usa.house_dem_moderate",
          "seats": 35
        },
        {
          "chamber": "chamber.usa.house",
          "bloc": "pc.usa.house_rep_moderate",
          "seats": 34
        },
        {
          "chamber": "chamber.usa.house",
          "bloc": "pc.usa.house_rep_mainstream",
          "seats": 146
        },
        {
          "chamber": "chamber.usa.house",
          "bloc": "pc.usa.house_rep_hardline",
          "seats": 34
        },
        {
          "chamber": "chamber.usa.senate",
          "bloc": "pc.usa.senate_rep_mainstream",
          "seats": 42
        },
        {
          "chamber": "chamber.usa.senate",
          "bloc": "pc.usa.senate_rep_hardline",
          "seats": 9
        },
        {
          "chamber": "chamber.usa.senate",
          "bloc": "pc.usa.senate_dem_progressive",
          "seats": 15
        },
        {
          "chamber": "chamber.usa.senate",
          "bloc": "pc.usa.senate_dem_mainstream",
          "seats": 34
        }
      ]
    }
  ],
  "goals": [
    {
      "id": "no_default",
      "nameKey": "scenario.xdate.goal.no_default",
      "kind": "Must",
      "condition": {
        "metric": "no_default",
        "technicalPenalty": 12,
        "technicalMaxScore": 44
      }
    },
    {
      "id": "stay_in_office",
      "nameKey": "scenario.xdate.goal.stay_in_office",
      "kind": "Must",
      "condition": {
        "metric": "in_office"
      }
    },
    {
      "id": "approval",
      "nameKey": "scenario.xdate.goal.approval",
      "kind": "Score",
      "weight": 0.2,
      "condition": {
        "metric": "approval",
        "par": 14
      }
    },
    {
      "id": "midterms",
      "nameKey": "scenario.xdate.goal.midterms",
      "kind": "Score",
      "weight": 0.2,
      "condition": {
        "metric": "seats",
        "par": 14
      }
    },
    {
      "id": "economy",
      "nameKey": "scenario.xdate.goal.economy",
      "kind": "Score",
      "weight": 0.2,
      "condition": {
        "metric": "economy",
        "par": 16
      }
    },
    {
      "id": "coalition",
      "nameKey": "scenario.xdate.goal.coalition",
      "kind": "Score",
      "weight": 0.15,
      "condition": {
        "metric": "coalition",
        "par": 14
      }
    },
    {
      "id": "fiscal",
      "nameKey": "scenario.xdate.goal.fiscal",
      "kind": "Score",
      "weight": 0.1,
      "condition": {
        "metric": "fiscal",
        "par": 20
      }
    },
    {
      "id": "institutions",
      "nameKey": "scenario.xdate.goal.institutions",
      "kind": "Score",
      "weight": 0.1,
      "condition": {
        "metric": "institutions",
        "par": 14
      }
    },
    {
      "id": "world",
      "nameKey": "scenario.xdate.goal.world",
      "kind": "Score",
      "weight": 0.05,
      "condition": {
        "metric": "world",
        "par": 18
      }
    }
  ],
  "endings": [
    {
      "id": "statesman",
      "nameKey": "scenario.xdate.ending.statesman",
      "minScore": 80
    },
    {
      "id": "dealmaker",
      "nameKey": "scenario.xdate.ending.dealmaker",
      "minScore": 65
    },
    {
      "id": "survivor",
      "nameKey": "scenario.xdate.ending.survivor",
      "minScore": 45
    },
    {
      "id": "pyrrhic",
      "nameKey": "scenario.xdate.ending.pyrrhic",
      "minScore": 0
    },
    {
      "id": "technical_default",
      "nameKey": "scenario.xdate.ending.technical_default",
      "condition": {
        "metric": "technical_default"
      }
    },
    {
      "id": "default",
      "nameKey": "scenario.xdate.ending.default",
      "defeat": true,
      "condition": {
        "metric": "default"
      }
    },
    {
      "id": "removed",
      "nameKey": "scenario.xdate.ending.removed",
      "defeat": true,
      "condition": {
        "metric": "removed"
      }
    }
  ]
}
