{
  "$schema": "../../schemas/scenario.schema.json",
  "meta": {
    "sources": [
      "src.seatofpower_authored"
    ],
    "notes": "Start: the day the government was sworn in (8 May 2026). End: the regular election, by April 2030 (the 52nd National Assembly was elected on 19 April 2026 for four years). Generated by tools/pipeline/author_bgr.py (package 27)."
  },
  "id": "scenario.eighth_election",
  "startDate": "2026-05-08",
  "endDate": "2030-04-14",
  "countries": [
    "country.bgr",
    "country.eu",
    "country.rus",
    "country.tur",
    "country.ukr",
    "country.mkd",
    "country.chn",
    "country.gbr"
  ],
  "nameKey": "scenario.eighth_election.name",
  "descriptionKey": "scenario.eighth_election.description",
  "playableCountry": "country.bgr",
  "playableParties": [
    "party.bgr.ph"
  ]
}
